{
  "$schema": "https://json-schema.org/draft/2020-12/schema",
  "title": "Outcome Harness Verification Evidence",
  "type": "object",
  "additionalProperties": false,
  "required": [
    "schema_version",
    "task_id",
    "run_id",
    "baseline",
    "changed_files",
    "scope_pass",
    "scope_violations",
    "required_checks_pass",
    "mechanical_result",
    "evidence_files",
    "timestamp",
    "duration"
  ],
  "properties": {
    "schema_version": {
      "type": "integer",
      "const": 1
    },
    "task_id": {
      "type": "string",
      "pattern": "^[A-Za-z0-9][A-Za-z0-9_-]*$"
    },
    "run_id": {
      "type": "string",
      "pattern": "^[A-Za-z0-9][A-Za-z0-9_-]*$"
    },
    "baseline": {
      "type": "string",
      "minLength": 1
    },
    "changed_files": {
      "type": "array",
      "items": {
        "$ref": "#/$defs/fileChange"
      }
    },
    "scope_pass": {
      "type": "boolean"
    },
    "scope_violations": {
      "type": "array",
      "items": {
        "$ref": "#/$defs/fileChange"
      }
    },
    "required_checks_pass": {
      "type": "boolean"
    },
    "mechanical_result": {
      "enum": [
        "pass",
        "fail"
      ]
    },
    "evidence_files": {
      "type": "array",
      "minItems": 1,
      "items": {
        "type": "string",
        "minLength": 1
      }
    },
    "timestamp": {
      "type": "string",
      "format": "date-time"
    },
    "duration": {
      "type": "number",
      "minimum": 0
    }
  },
  "$defs": {
    "fileChange": {
      "type": "object",
      "additionalProperties": false,
      "required": [
        "source",
        "status",
        "path",
        "previous_path",
        "old_mode",
        "new_mode",
        "mode_changed",
        "is_binary",
        "in_scope"
      ],
      "properties": {
        "source": {
          "enum": [
            "committed",
            "staged",
            "unstaged",
            "untracked"
          ]
        },
        "status": {
          "type": "string",
          "minLength": 1
        },
        "path": {
          "type": "string",
          "minLength": 1
        },
        "previous_path": {
          "type": [
            "string",
            "null"
          ]
        },
        "old_mode": {
          "type": [
            "string",
            "null"
          ]
        },
        "new_mode": {
          "type": [
            "string",
            "null"
          ]
        },
        "mode_changed": {
          "type": "boolean"
        },
        "is_binary": {
          "type": "boolean"
        },
        "in_scope": {
          "type": "boolean"
        }
      }
    }
  }
}
